{"schema_version":"target-vacancy-research-v1","research_kind":"sre_platform_devops_current_vacancies","locale":"es","as_of_date":"2026-08-13","search_scope":{"geography_scope":"mexico_or_stated_remote","target_role_families":["site_reliability_engineering","platform_engineering","devops_engineering"],"maximum_vacancies":5,"distinct_employers_preferred":true,"official_sources_first":true,"linkedin_jobs_backup_allowed":true,"no_eligibility_inference":true},"state":"market_evidence_unavailable","search_limit":{"bounded_queries_run":12,"limit_reason":"market_evidence_unavailable","distinct_employer_search_exhausted":false,"limitation":"Synthetic test unavailability."},"employers":[],"vacancies":[],"privacy_boundary":"public_vacancy_sources_and_identity_free_candidate_evidence_only","no_external_action":true}
