{"schema_version":"target-vacancy-research-v1","research_kind":"sre_platform_devops_current_vacancies","locale":"es","as_of_date":"2026-08-13","search_scope":{"geography_scope":"mexico_or_stated_remote","target_role_families":["site_reliability_engineering","platform_engineering","devops_engineering"],"maximum_vacancies":5,"distinct_employers_preferred":true,"official_sources_first":true,"linkedin_jobs_backup_allowed":true,"no_eligibility_inference":true},"state":"complete","search_limit":{"bounded_queries_run":12,"limit_reason":"target_reached","distinct_employer_search_exhausted":false,"limitation":"none"},"employers":[{"employer_id":"EMP-001","display_name":"Fixture Employer A","qualification_type":"official_headcount","qualification_observation":"Synthetic test qualification.","official_source_title":"Synthetic careers index","official_source_url":"https://www.rfc-editor.org/rfc/rfc2606","source_date":"2026-08-13","access_date":"2026-08-13"},{"employer_id":"EMP-002","display_name":"Fixture Employer B","qualification_type":"official_headcount","qualification_observation":"Synthetic test qualification.","official_source_title":"Synthetic careers index","official_source_url":"https://www.rfc-editor.org/rfc/rfc5737","source_date":"2026-08-13","access_date":"2026-08-13"},{"employer_id":"EMP-003","display_name":"Fixture Employer C","qualification_type":"official_headcount","qualification_observation":"Synthetic test qualification.","official_source_title":"Synthetic careers index","official_source_url":"https://www.rfc-editor.org/rfc/rfc6761","source_date":"2026-08-13","access_date":"2026-08-13"},{"employer_id":"EMP-004","display_name":"Fixture Employer D","qualification_type":"official_headcount","qualification_observation":"Synthetic test qualification.","official_source_title":"Synthetic careers index","official_source_url":"https://www.rfc-editor.org/rfc/rfc3849","source_date":"2026-08-13","access_date":"2026-08-13"},{"employer_id":"EMP-005","display_name":"Fixture Employer E","qualification_type":"official_headcount","qualification_observation":"Synthetic test qualification.","official_source_title":"Synthetic careers index","official_source_url":"https://www.rfc-editor.org/rfc/rfc1918","source_date":"2026-08-13","access_date":"2026-08-13"}],"vacancies":[{"vacancy_id":"V-001","duplicate_fingerprint":"fixture-fingerprint-001","employer_id":"EMP-001","title":"Fixture Reliability Role A","role_family":"site_reliability_engineering","location":"Mexico","arrangement":"remote","geographic_compatibility":"explicit_mexico","source_kind":"official_employer","source_url":"https://www.rfc-editor.org/rfc/rfc2606#fixture-v-001","official_referrer_url":null,"source_state":"active","access_date":"2026-08-13","publication_date":"2026-08-12","freshness_status":"current","eligibility_gates":[{"gate":"country_geography","state":"pass","observed_condition":"Mexico stated."}],"requirements":[{"requirement_id":"V-001-R-01","signal":"python","importance":"must_have","source_paraphrase":"Synthetic test requirement."}]},{"vacancy_id":"V-002","duplicate_fingerprint":"fixture-fingerprint-002","employer_id":"EMP-002","title":"Fixture Platform Role B","role_family":"platform_engineering","location":"Mexico","arrangement":"hybrid","geographic_compatibility":"explicit_mexico","source_kind":"official_employer","source_url":"https://www.rfc-editor.org/rfc/rfc5737#fixture-v-002","official_referrer_url":null,"source_state":"active","access_date":"2026-08-13","publication_date":"2026-08-11","freshness_status":"current","eligibility_gates":[{"gate":"country_geography","state":"pass","observed_condition":"Mexico stated."}],"requirements":[{"requirement_id":"V-002-R-01","signal":"kubernetes","importance":"must_have","source_paraphrase":"Synthetic test requirement."}]},{"vacancy_id":"V-003","duplicate_fingerprint":"fixture-fingerprint-003","employer_id":"EMP-003","title":"Fixture DevOps Role C","role_family":"devops_engineering","location":"Mexico","arrangement":"flexible","geographic_compatibility":"explicit_mexico","source_kind":"official_employer","source_url":"https://www.rfc-editor.org/rfc/rfc6761#fixture-v-003","official_referrer_url":null,"source_state":"active","access_date":"2026-08-13","publication_date":"2026-08-10","freshness_status":"current","eligibility_gates":[{"gate":"country_geography","state":"pass","observed_condition":"Mexico stated."}],"requirements":[{"requirement_id":"V-003-R-01","signal":"terraform","importance":"must_have","source_paraphrase":"Synthetic test requirement."}]},{"vacancy_id":"V-004","duplicate_fingerprint":"fixture-fingerprint-004","employer_id":"EMP-004","title":"Fixture Reliability Role D","role_family":"site_reliability_engineering","location":"Remote","arrangement":"remote","geographic_compatibility":"stated_remote_unknown_eligibility","source_kind":"official_employer","source_url":"https://www.rfc-editor.org/rfc/rfc3849#fixture-v-004","official_referrer_url":null,"source_state":"active","access_date":"2026-08-13","publication_date":"2026-08-09","freshness_status":"current","eligibility_gates":[{"gate":"country_geography","state":"unknown","observed_condition":"Remote stated without eligibility conclusion."}],"requirements":[{"requirement_id":"V-004-R-01","signal":"observability","importance":"preferred","source_paraphrase":"Synthetic test requirement."}]},{"vacancy_id":"V-005","duplicate_fingerprint":"fixture-fingerprint-005","employer_id":"EMP-005","title":"Fixture Platform Role E","role_family":"platform_engineering","location":"Mexico","arrangement":"onsite","geographic_compatibility":"explicit_mexico","source_kind":"official_employer","source_url":"https://www.rfc-editor.org/rfc/rfc1918#fixture-v-005","official_referrer_url":null,"source_state":"active","access_date":"2026-08-13","publication_date":"2026-08-08","freshness_status":"current","eligibility_gates":[{"gate":"country_geography","state":"pass","observed_condition":"Mexico stated."}],"requirements":[{"requirement_id":"V-005-R-01","signal":"linux","importance":"responsibility_only","source_paraphrase":"Synthetic test requirement."}]}],"privacy_boundary":"public_vacancy_sources_and_identity_free_candidate_evidence_only","no_external_action":true}
